Names,Role,ID,Email,Select the Department you belong to.,Please select if you are a Lead or Co-Lead,LinkedIn profile link,GitHub profile link,Instagram profile link,Facebook profile link,Something you wanna say about yourself,Some skills you wanna say about yourself,Please upload an image of yourself that would we displayed in the website.,No. of Contributions you have made so far,No. of Project,No. of months of experience
Pawan Mamidi,Event Manager,1,,Event Management,,https://www.linkedin.com/in/pawan-mamidi-375838275,,https://instagram.com/s_o_l_o_union?igshid=NGVhN2U2NjQ0Yg==,,I am a person who likes to interactive more with people and have fun,Leadership&#44 management skills,,1,0,2
Estasiddhi Karthik,Event Manager,2,karthik.22bce7997@vitapstudent.ac.in,Event Management,,https://www.linkedin.com/in/karthik-estasiddhi-b96b37259,https://github.com/KarthikEstasiddhi,https://instagram.com/karthik_estasiddhi?igshid=MzNlNGNkZWQ4Mg==,,I am a second-year B Tech undergrad; passionately delving into the world of Data Analytics within the CSE Department while fueling my enthusiasm for event management. <br><br> I am a passionate and driven individual with a strong commitment to fostering innovation and technical excellence. <br><br>My vision for GeeksforGeeks is to continue pushing the boundaries of what we can achieve.<br><br>My aim is to facilitate and curate events that not only educate and inspire but also provide a platform for individuals to connect; share ideas; and grow both personally and professionally.,I'm excited to connect with fellow professionals  share insights  and explore potential collaborations. Let's connect and discuss how we can work together to achieve our mutual goals. <br><br>As an Event Manager  I thrive on creating memorable and engaging experiences for our members and the broader tech community.,https://drive.google.com/u/0/open?usp=forms_web&id=1Sn8MuZ2Y5_SYBJ4Pg-Gl4HxH0MenIx1J,1,1,1+
Aryan Lunia,Event Manager,3,aryan.22bce8809@vitapstudent.ac.in,Event Management,,https://www.linkedin.com/in/aryan-lunia-88a347248,https://github.com/aryanjain2207,https://instagram.com/itz_aryan2207?igshid=MzRlODBiNWFlZA==,,I am a Btech student who is persuaing Computer Science and Engineering and have an aim of becoming a full stack web developer.,Team management; Hosting; Drawing; Playing Guitar; HTML; CSS,https://drive.google.com/u/0/open?usp=forms_web&id=1KTCr25WuctYwy12JIACBPy1lHuV9KCw3,4,2,3
Vinod Kumar Pagadala,Event Manager,4,vinod.22bce8419@vitapstudent.ac.in,Event Management,,https://www.linkedin.com/in/vinod-pagadala-0ab7a3275/,https://github.com/Vinod-9989,https://www.instagram.com/vinod99899,https://www.facebook.com/vinod.pagadala.1232,I am comfortable with python&#44 java programming language. I have done some Projects and some of the academic activities in Microsoft office using PowerPoint and word which made me gaining knowledge in that aspects. I am comfortable with my Communication skills as I have participated in MUN(MODEL UNITED NATIONS)<br><br> When I am in 12th standard. Skilled in operating a variety of tools&#44 machinary and equipment for both indoor and outdoor projects. Experienced in carrying out general labour duties&#44 including loading and unloading materials&#44 demolition&#44 and site preparation.Possesses a valid driver's license and a string work ethic&#44 Responsible Student with good jugment&#44 time management&#44 and a flexible schedule.Frequently praised as hard working by my peers.,Hi I am vinod .I am from Hyderabad. Currently I am persuing my B-tech in Vit ap University in computer science department .My hobbies are playing badminton and reading books.I am part of Geeks for geeks student chapter in my college.As a cse student I need to gain knowledge in programming skills&#44 but I am sure that I can come across them further in this journey.,https://drive.google.com/u/0/open?usp=forms_web&id=1iNNgAa82aU8BkYmwWiKm-T9HBmiLc4kM,5,6,1
Dhruv Agarwal,Event Manager,5,dhruv.22bce8528@vitapstudent.ac.in,Event Management,,www.linkedin.com/in/dhruv-agarwal-1b256a274,https://github.com/dhruv307,https://www.instagram.com/dhruv__374/,https://www.facebook.com/agarwaldhruv30,I am a hardworking and passionate individual; always eager to embrace new learning opportunities and explore uncharted territories. I thrive on facing life's challenges head-on. As an engineering student; I'm driven by a deep curiosity and a thirst for innovation; which fuels my pursuit of excellence.,Leadership; Time-Management; Public-Speaking; Communication; Research & Analysis; Adaptability; Resilience,https://drive.google.com/u/0/open?usp=forms_web&id=1BW8doL3f_fC-4grD4Vj6mcNv3BsOyhxz,1,1,1
Akshaya Korrapati,Event Manager,6,akshaya.22bce8964@vitapstudent.ac.in,Event Management,,https://www.linkedin.com/in/akshaya-korrapati-b4215a257,https://github.com/AkshayaKorrapati,https://instagram.com/akshayakorrapati?igshid=MzMyNGUyNmU2YQ==,,I am a dedicated person who is always looking for new experiences. I have a strong ethic and am very motivated towards what I do. I enjoy working with others and am always happy to help. I am a fast learner and always want to learn new things.,I have very strong passion towards event management.I have good listening; problem-solving;organisational skills.I have ability to keep calm under pressure. ,https://drive.google.com/u/0/open?usp=forms_web&id=1KPn3QxuUPfc0H71nXForr5Q4w59yuYfs,0,0,0
